{
	"version": 1,
	"requiredHeader": "# AGENTS",
	"requiredLine": "AGENTS.md is authoritative for structure and behavior. Deviations are blocked by CI.",
	"requiredSections": [
		"Roles",
		"Boundaries",
		"Inputs",
		"Outputs",
		"Memory",
		"Governance"
	],
	"forbiddenPhrases": ["I feel", "emotion", "empath"],
	"filesThatMustReferenceAgents": []
}
